<?xml version="1.0" encoding="UTF-8"?>
<!DOCTYPE mdc2 SYSTEM 'mdc2.dtd'>
<mdc2>
    <s>i</s>
    <s>w</s>
    <q>
        <v>
            <s>r</s>
            <s>a</s>
        </v>
    </q>
    <s>ra</s>
    <s>m</s>
    <q>
        <v>
              
            <s>p</s>
            <s>t</s>
        </v>
        <v>
            <s>pt</s>                
        </v>
    </q>
</mdc2>